{
  "$schema": "https://json-schema.org/draft/2020-12/schema",
  "$id": "https://appbuilder.dev/schemas/integration-contract/1.0",
  "title": "Cordango Integration Contract",
  "description": "What an app may depend on when it uses an external system: entities with typed fields, what can be done to them, how they can be queried and which figures the provider can compute exactly. Provider-independent: a provider says how one API implements it. Never contains a URL, a credential or an API field name.",
  "type": "object",
  "additionalProperties": false,
  "required": ["kind", "name", "version", "entities"],
  "properties": {
    "kind": { "const": "IntegrationContract" },
    "name": {
      "description": "The contract's permanent name, dotted: '<namespace>.<name>' ('hubspot.crm' for a provider-specific contract, 'crm.contacts' for a shared one). The dot is required, so a contract can never share a name with an app.",
      "$ref": "#/$defs/integrationName"
    },
    "version": {
      "description": "The MAJOR version. A breaking change is a new major, which is a new contract: apps pin 'name@major'.",
      "type": "integer",
      "minimum": 1,
      "maximum": 999
    },
    "label": { "type": "string", "minLength": 1, "maxLength": 80 },
    "description": { "type": "string", "maxLength": 600 },
    "entities": {
      "description": "Entities by key. Keys follow the same rule as app entity keys.",
      "type": "object",
      "minProperties": 1,
      "maxProperties": 40,
      "propertyNames": { "$ref": "#/$defs/identifier" },
      "additionalProperties": { "$ref": "#/$defs/entity" }
    }
  },
  "$defs": {
    "identifier": { "type": "string", "pattern": "^[a-z][a-z0-9_]*$", "minLength": 1, "maxLength": 63 },
    "integrationName": {
      "type": "string",
      "pattern": "^[a-z][a-z0-9_]*(\\.[a-z][a-z0-9_]*)+$",
      "minLength": 3,
      "maxLength": 80
    },
    "entity": {
      "type": "object",
      "additionalProperties": false,
      "required": ["fields", "displayField", "capabilities"],
      "properties": {
        "label": { "type": "string", "minLength": 1, "maxLength": 80 },
        "labelPlural": { "type": "string", "minLength": 1, "maxLength": 80 },
        "displayField": {
          "description": "The field a row is known by, as an app entity's displayField.",
          "$ref": "#/$defs/identifier"
        },
        "fields": {
          "type": "object",
          "minProperties": 1,
          "maxProperties": 120,
          "propertyNames": { "$ref": "#/$defs/identifier" },
          "additionalProperties": { "$ref": "#/$defs/field" }
        },
        "capabilities": {
          "description": "What may be done to this entity. A provider that implements the contract must implement every one. 'create', 'update' and 'delete' are accepted by the language and refused by the gate until writes exist.",
          "type": "array",
          "minItems": 1,
          "uniqueItems": true,
          "items": { "enum": ["list", "get", "search", "create", "update", "delete"] }
        },
        "query": { "$ref": "#/$defs/query" }
      }
    },
    "field": {
      "type": "object",
      "additionalProperties": false,
      "required": ["type"],
      "properties": {
        "type": {
          "description": "An app field type. 'reference' and 'attachment' are not available in contracts yet.",
          "enum": ["text", "longtext", "integer", "decimal", "money", "boolean", "date", "datetime",
                   "email", "url", "phone", "select", "multiselect", "json"]
        },
        "label": { "type": "string", "minLength": 1, "maxLength": 80 },
        "required": {
          "description": "Every row carries a value. A provider must map it.",
          "type": "boolean"
        },
        "readonly": {
          "description": "Never written by an app, even once writes exist ('id', 'updated_at').",
          "type": "boolean"
        },
        "options": {
          "description": "The values a select or multiselect field may hold.",
          "type": "array",
          "minItems": 1,
          "maxItems": 200,
          "items": {
            "oneOf": [
              { "$ref": "#/$defs/identifier" },
              {
                "type": "object",
                "additionalProperties": false,
                "required": ["value"],
                "properties": {
                  "value": { "$ref": "#/$defs/identifier" },
                  "label": { "type": "string", "minLength": 1, "maxLength": 80 }
                }
              }
            ]
          }
        }
      }
    },
    "query": {
      "description": "How rows of this entity may be asked for. Anything not declared here is refused by the gate in an app, because a filter the provider cannot apply would otherwise be applied to one page of rows and read as the answer.",
      "type": "object",
      "additionalProperties": false,
      "properties": {
        "filter": {
          "description": "Filterable fields and the operators each allows.",
          "type": "object",
          "propertyNames": { "$ref": "#/$defs/identifier" },
          "additionalProperties": {
            "type": "array",
            "minItems": 1,
            "uniqueItems": true,
            "items": { "enum": ["eq", "neq", "gt", "gte", "lt", "lte", "contains", "in", "notIn", "isEmpty", "isNotEmpty"] }
          }
        },
        "sort": {
          "description": "Fields the provider can sort by.",
          "type": "array",
          "uniqueItems": true,
          "items": { "$ref": "#/$defs/identifier" }
        },
        "aggregate": {
          "description": "Figures the provider computes exactly, server-side. Absent means not available: an app figure over this entity is then refused rather than counted from one page.",
          "type": "object",
          "additionalProperties": false,
          "properties": {
            "count": { "type": "boolean" },
            "sum": { "$ref": "#/$defs/fieldList" },
            "avg": { "$ref": "#/$defs/fieldList" },
            "min": { "$ref": "#/$defs/fieldList" },
            "max": { "$ref": "#/$defs/fieldList" }
          }
        }
      }
    },
    "fieldList": {
      "type": "array",
      "minItems": 1,
      "uniqueItems": true,
      "items": { "$ref": "#/$defs/identifier" }
    }
  }
}
